{
  "version": 1,
  "id": 2,
  "name": "Level 2",
  "grid": {
    "width": 16,
    "height": 12,
    "tileSize": 8
  },
  "paths": {
    "ground": [
      [0, 64],
      [8, 64],
      [16, 64],
      [16, 72],
      [16, 80],
      [24, 80],
      [32, 80],
      [40, 80],
      [40, 80],
      [40, 72],
      [40, 64],
      [40, 56],
      [40, 48],
      [40, 40],
      [40, 32],
      [40, 24],
      [40, 16],
      [48, 16],
      [48, 16],
      [56, 16],
      [64, 16],
      [64, 24],
      [64, 32],
      [72, 32],
      [80, 32],
      [80, 24],
      [80, 16],
      [88, 16],
      [96, 16],
      [96, 24],
      [96, 32],
      [96, 40],
      [96, 48],
      [96, 56],
      [96, 64],
      [96, 64],
      [104, 64],
      [112, 64],
      [120, 64]
    ],
    "flying": [
      [0, 64],
      [8, 64],
      [16, 64],
      [24, 64],
      [32, 64],
      [40, 64],
      [48, 64],
      [56, 64],
      [64, 64],
      [72, 64],
      [80, 64],
      [88, 64],
      [96, 64],
      [104, 64],
      [112, 64],
      [120, 64]
    ]
  },
  "scene": {
    "terrain": {
      "model": "models/Map.obj",
      "texture": "textures/MapDiffuse.webp",
      "position": [64, 0, -48]
    },
    "pathTile": {
      "model": "models/Tile.obj",
      "texture": "textures/TileDiffuse.webp"
    },
    "buildableTile": {
      "model": "models/BuildTile.obj",
      "texture": "textures/BuildTileDiffuse.webp"
    },
    "wall": {
      "model": "models/Wall.obj",
      "texture": "textures/WallDiffuse.webp",
      "position": [144, 0, -48.55]
    },
    "props": [
      {
        "model": "models/WhiteHouse.obj",
        "texture": "textures/WhiteHouseDiffuse.webp",
        "position": [163, 0, -48]
      },
      {
        "model": "models/WallHeight.obj",
        "texture": "textures/WallHeightDiffuse.webp",
        "position": [128, 0, -48]
      },
      {
        "model": "models/MexicanMafia.obj",
        "texture": "textures/MexicanMafiaDiffuse.webp",
        "position": [156, 18, -48],
        "rotationY": 3.141592653589793
      },
      {
        "model": "models/Navodila.obj",
        "texture": "textures/NavodilaDiffuse.webp",
        "position": [158, 0, 0]
      },
      {
        "model": "models/Odar.obj",
        "texture": "textures/OdarDiffuse.webp",
        "position": [138, 0, -96]
      },
      {
        "model": "models/Builder.obj",
        "texture": "textures/BuilderDiffuse.webp",
        "specular": "textures/BuilderSpecular.webp",
        "position": [140, 5, -98],
        "rotationY": 1.5707963267948966
      },
      {
        "model": "models/Hammer.obj",
        "texture": "textures/HammerDiffuse.webp",
        "specular": "textures/HammerSpecular.webp",
        "position": [139.5, 6, -97.7]
      },
      {
        "model": "models/Odar.obj",
        "texture": "textures/OdarDiffuse.webp",
        "position": [138, 0, -84]
      },
      {
        "model": "models/Builder.obj",
        "texture": "textures/BuilderDiffuse.webp",
        "specular": "textures/BuilderSpecular.webp",
        "position": [140, 5, -86],
        "rotationY": 1.5707963267948966
      },
      {
        "model": "models/Hammer.obj",
        "texture": "textures/HammerDiffuse.webp",
        "specular": "textures/HammerSpecular.webp",
        "position": [139.5, 6, -85.7]
      },
      {
        "model": "models/Odar.obj",
        "texture": "textures/OdarDiffuse.webp",
        "position": [138, 0, -72]
      },
      {
        "model": "models/Builder.obj",
        "texture": "textures/BuilderDiffuse.webp",
        "specular": "textures/BuilderSpecular.webp",
        "position": [140, 5, -74],
        "rotationY": 1.5707963267948966
      },
      {
        "model": "models/Hammer.obj",
        "texture": "textures/HammerDiffuse.webp",
        "specular": "textures/HammerSpecular.webp",
        "position": [139.5, 6, -73.7]
      },
      {
        "model": "models/Odar.obj",
        "texture": "textures/OdarDiffuse.webp",
        "position": [138, 0, -60]
      },
      {
        "model": "models/Builder.obj",
        "texture": "textures/BuilderDiffuse.webp",
        "specular": "textures/BuilderSpecular.webp",
        "position": [140, 5, -62],
        "rotationY": 1.5707963267948966
      },
      {
        "model": "models/Hammer.obj",
        "texture": "textures/HammerDiffuse.webp",
        "specular": "textures/HammerSpecular.webp",
        "position": [139.5, 6, -61.7]
      },
      {
        "model": "models/Odar.obj",
        "texture": "textures/OdarDiffuse.webp",
        "position": [138, 0, -48]
      },
      {
        "model": "models/Builder.obj",
        "texture": "textures/BuilderDiffuse.webp",
        "specular": "textures/BuilderSpecular.webp",
        "position": [140, 5, -50],
        "rotationY": 1.5707963267948966
      },
      {
        "model": "models/Hammer.obj",
        "texture": "textures/HammerDiffuse.webp",
        "specular": "textures/HammerSpecular.webp",
        "position": [139.5, 6, -49.7]
      },
      {
        "model": "models/Odar.obj",
        "texture": "textures/OdarDiffuse.webp",
        "position": [138, 0, -36]
      },
      {
        "model": "models/Builder.obj",
        "texture": "textures/BuilderDiffuse.webp",
        "specular": "textures/BuilderSpecular.webp",
        "position": [140, 5, -38],
        "rotationY": 1.5707963267948966
      },
      {
        "model": "models/Hammer.obj",
        "texture": "textures/HammerDiffuse.webp",
        "specular": "textures/HammerSpecular.webp",
        "position": [139.5, 6, -37.7]
      },
      {
        "model": "models/Odar.obj",
        "texture": "textures/OdarDiffuse.webp",
        "position": [138, 0, -24]
      },
      {
        "model": "models/Builder.obj",
        "texture": "textures/BuilderDiffuse.webp",
        "specular": "textures/BuilderSpecular.webp",
        "position": [140, 5, -26],
        "rotationY": 1.5707963267948966
      },
      {
        "model": "models/Hammer.obj",
        "texture": "textures/HammerDiffuse.webp",
        "specular": "textures/HammerSpecular.webp",
        "position": [139.5, 6, -25.7]
      },
      {
        "model": "models/Odar.obj",
        "texture": "textures/OdarDiffuse.webp",
        "position": [138, 0, -12]
      },
      {
        "model": "models/Builder.obj",
        "texture": "textures/BuilderDiffuse.webp",
        "specular": "textures/BuilderSpecular.webp",
        "position": [140, 5, -14],
        "rotationY": 1.5707963267948966
      },
      {
        "model": "models/Hammer.obj",
        "texture": "textures/HammerDiffuse.webp",
        "specular": "textures/HammerSpecular.webp",
        "position": [139.5, 6, -13.7]
      },
      {
        "model": "models/House1.obj",
        "texture": "textures/House1Diffuse.webp",
        "position": [-40, 0, -96]
      },
      {
        "model": "models/House2.obj",
        "texture": "textures/House2Diffuse.webp",
        "position": [-40, 0, -72]
      },
      {
        "model": "models/Cactus.obj",
        "texture": "textures/CactusDiffuse.webp",
        "position": [-35, 0, -67]
      },
      {
        "model": "models/House1.obj",
        "texture": "textures/House1Diffuse.webp",
        "position": [-40, 0, -48]
      },
      {
        "model": "models/Cactus.obj",
        "texture": "textures/CactusDiffuse.webp",
        "position": [-35, 0, -19]
      },
      {
        "model": "models/Cactus.obj",
        "texture": "textures/CactusDiffuse.webp",
        "position": [-45, 0, -17]
      },
      {
        "model": "models/Cactus.obj",
        "texture": "textures/CactusDiffuse.webp",
        "position": [-55, 0, 2]
      },
      {
        "model": "models/House1.obj",
        "texture": "textures/House1Diffuse.webp",
        "position": [-20, 0, -72]
      },
      {
        "model": "models/Cactus.obj",
        "texture": "textures/CactusDiffuse.webp",
        "position": [-15, 0, -67]
      },
      {
        "model": "models/House2.obj",
        "texture": "textures/House2Diffuse.webp",
        "position": [-20, 0, -48]
      },
      {
        "model": "models/Cactus.obj",
        "texture": "textures/CactusDiffuse.webp",
        "position": [-15, 0, -43]
      },
      {
        "model": "models/Cactus.obj",
        "texture": "textures/CactusDiffuse.webp",
        "position": [-10, 0, -43]
      },
      {
        "model": "models/House1.obj",
        "texture": "textures/House1Diffuse.webp",
        "position": [-30, 0, -19]
      },
      {
        "model": "models/House2.obj",
        "texture": "textures/House2Diffuse.webp",
        "position": [-25, 0, 5]
      },
      {
        "model": "models/House1.obj",
        "texture": "textures/House1Diffuse.webp",
        "position": [-50, 0, -96]
      },
      {
        "model": "models/Cactus.obj",
        "texture": "textures/CactusDiffuse.webp",
        "position": [-45, 0, -57]
      },
      {
        "model": "models/House1.obj",
        "texture": "textures/House1Diffuse.webp",
        "position": [-50, 0, -28]
      },
      {
        "model": "models/Cactus.obj",
        "texture": "textures/CactusDiffuse.webp",
        "position": [-45, 0, -23]
      },
      {
        "model": "models/Cactus.obj",
        "texture": "textures/CactusDiffuse.webp",
        "position": [-40, 0, -23]
      }
    ],
    "skybox": [
      "skyboxes/TrumpDefenseNight/right.jpg",
      "skyboxes/TrumpDefenseNight/left.jpg",
      "skyboxes/TrumpDefenseNight/top.jpg",
      "skyboxes/TrumpDefenseNight/bottom.jpg",
      "skyboxes/TrumpDefenseNight/front.jpg",
      "skyboxes/TrumpDefenseNight/back.jpg"
    ],
    "ambient": {
      "color": "#ffffff",
      "intensity": 0.12
    },
    "directional": {
      "color": "#bba661",
      "intensity": 0,
      "position": [20, 80, 30],
      "target": [64, 0, -48]
    },
    "points": [
      {
        "color": "#ffffff",
        "intensity": 180,
        "position": [1, 21, -63],